{
  "schema_version": "AGL_LITE_V1_2_1",
  "project_id": "AGL-LITE-EXAMPLE",
  "policy_version": "policy-v1.2.1",
  "created_at_utc": "2026-10-27T00:00:00Z",
  "event_id": "EV-001",
  "task_id": "TASK-001",
  "actor_id": "AGENT_A",
  "event_type": "TASK_READY",
  "target_kind": "TASK",
  "target_id": "TASK-001",
  "expected_state": "PROPOSED",
  "requested_state": "READY",
  "attempt_epoch": 0,
  "spec_hash": "aaaaaaaaaaaaaaaaaaaaaaaaaaaaaaaaaaaaaaaaaaaaaaaaaaaaaaaaaaaaaaaa",
  "source_commit_sha": "bbbbbbbbbbbbbbbbbbbbbbbbbbbbbbbbbbbbbbbb",
  "evidence_ref": "evidence/EV-001.json",
  "operation_id": "OP-001",
  "idempotency_key": "TASK-001:0:TASK_READY"
}
